{
  "accepted": true,
  "status": "accepted",
  "chunk_id": "chunk-hr-000001",
  "session_id": "session-2026-04-23T09-30-00Z-polar-001",
  "stream_id": "stream-hr-001",
  "received_at_server": "2026-04-23T09:30:03Z",
  "storage": {
    "raw_persisted": true,
    "storage_path": "raw/session-2026-04-23T09-30-00Z-polar-001/stream-hr-001/chunk-hr-000001.json"
  },
  "message": "Chunk accepted and raw payload persisted."
}
